{
  "checkpoint": { "version": 12, "asOf": "2026-07-15T12:15:00Z" },
  "chainMode": "TESTNET",
  "sandbox": true,
  "claim": {
    "id": "0198a5ea-7c9c-7000-8000-000000000101",
    "claimKey": "aaaaaaaaaaaaaaaaaaaaaaaaaaaaaaaaaaaaaaaaaaaaaaaaaaaaaaaaaaaaaaaa",
    "tenantId": "0198a5ea-7c9c-7000-8000-000000000100",
    "sellerId": "0198a5ea-7c9c-7000-8000-000000000102",
    "settlementStreamId": "0198a5ea-7c9c-7000-8000-000000000103",
    "facilityId": "0198a5ea-7c9c-7000-8000-000000000104",
    "state": "CLOSED",
    "sourceCurrency": "IDR",
    "grossUnsettled": { "amountMinor": "10000000", "currency": "IDR", "scale": 2 },
    "eligibleSettlementValue": { "amountMinor": "8000000", "currency": "IDR", "scale": 2 },
    "advanceAmount": { "amountMinor": "6400000", "currency": "IDR", "scale": 2 },
    "outstandingPrincipal": { "amountMinor": "0", "currency": "IDR", "scale": 2 },
    "latestAttestationId": "0198a5ea-7c9c-7000-8000-000000000105",
    "controlEvidenceId": "0198a5ea-7c9c-7000-8000-000000000106",
    "onchainContractId": "CAAAAAAAAAAAAAAAAAAAAAAAAAAAAAAAAAAAAAAAAAAAAAAAAAAAAAAA",
    "onchainTxHash": "bbbbbbbbbbbbbbbbbbbbbbbbbbbbbbbbbbbbbbbbbbbbbbbbbbbbbbbbbbbbbbbb",
    "stateReasonCodes": [],
    "createdAt": "2026-07-15T12:00:00Z",
    "updatedAt": "2026-07-15T12:15:00Z",
    "version": 12
  },
  "latestAttestation": {
    "schema": "JEJAK_JCC_V1",
    "id": "0198a5ea-7c9c-7000-8000-000000000105",
    "attestationKey": "cccccccccccccccccccccccccccccccccccccccccccccccccccccccccccccccc",
    "claimId": "0198a5ea-7c9c-7000-8000-000000000101",
    "claimKey": "aaaaaaaaaaaaaaaaaaaaaaaaaaaaaaaaaaaaaaaaaaaaaaaaaaaaaaaaaaaaaaaa",
    "sellerSubjectHash": "dddddddddddddddddddddddddddddddddddddddddddddddddddddddddddddddd",
    "settlementStreamId": "0198a5ea-7c9c-7000-8000-000000000103",
    "dataSnapshotHash": "eeeeeeeeeeeeeeeeeeeeeeeeeeeeeeeeeeeeeeeeeeeeeeeeeeeeeeeeeeeeeeee",
    "modelId": "jejak-sandbox-transparent-v1",
    "modelVersion": "1.0.0",
    "policyVersion": "sandbox-1",
    "decision": "ELIGIBLE",
    "sdsBps": 1200,
    "grossUnsettled": { "amountMinor": "10000000", "currency": "IDR", "scale": 2 },
    "eligibleSettlementValue": { "amountMinor": "8000000", "currency": "IDR", "scale": 2 },
    "maxAdvanceAmount": { "amountMinor": "6400000", "currency": "IDR", "scale": 2 },
    "reasonCodes": [],
    "issuedAt": "2026-07-15T12:02:00Z",
    "expiresAt": "2026-07-16T12:02:00Z",
    "status": "ACTIVE",
    "keyId": "sandbox-jcc-2026-07",
    "signature": "c2lnbmF0dXJl"
  },
  "latestOffer": {
    "id": "0198a5ea-7c9c-7000-8000-000000000107",
    "claimId": "0198a5ea-7c9c-7000-8000-000000000101",
    "originatorId": "0198a5ea-7c9c-7000-8000-000000000108",
    "principal": { "amountMinor": "6400000", "currency": "IDR", "scale": 2 },
    "fee": { "amountMinor": "160000", "currency": "IDR", "scale": 2 },
    "annualizedRateBps": 1800,
    "advanceRateBps": 8000,
    "expiresAt": "2026-07-16T12:03:00Z",
    "termsHash": "ffffffffffffffffffffffffffffffffffffffffffffffffffffffffffffffff",
    "status": "ACCEPTED",
    "createdAt": "2026-07-15T12:03:00Z",
    "version": 2
  },
  "controlEvidence": {
    "id": "0198a5ea-7c9c-7000-8000-000000000106",
    "claimId": "0198a5ea-7c9c-7000-8000-000000000101",
    "mode": "SANDBOX",
    "status": "VERIFIED",
    "structure": "CONTROLLED_ACCOUNT",
    "evidenceHash": "1111111111111111111111111111111111111111111111111111111111111111",
    "verifiedBy": "0198a5ea-7c9c-7000-8000-000000000108",
    "verifiedAt": "2026-07-15T12:05:00Z",
    "reasonCodes": [],
    "createdAt": "2026-07-15T12:04:00Z",
    "updatedAt": "2026-07-15T12:05:00Z",
    "version": 2
  },
  "facilityPosition": {
    "id": "0198a5ea-7c9c-7000-8000-000000000109",
    "facilityId": "0198a5ea-7c9c-7000-8000-000000000104",
    "claimId": "0198a5ea-7c9c-7000-8000-000000000101",
    "jclaimAssetCode": "JCLAIM",
    "jclaimIssuer": "GAAAAAAAAAAAAAAAAAAAAAAAAAAAAAAAAAAAAAAAAAAAAAAAAAAAAAAA",
    "fundingAssetCode": "JUSD",
    "fundingAssetIssuer": "GAAAAAAAAAAAAAAAAAAAAAAAAAAAAAAAAAAAAAAAAAAAAAAAAAAAAAAA",
    "principalBaseUnits": "64000000",
    "jclaimBaseUnits": "0",
    "firstLossBaseUnits": "8000000",
    "fundedAt": "2026-07-15T12:08:00Z",
    "repaidAt": "2026-07-15T12:14:00Z",
    "onchainTxHashes": [
      "2222222222222222222222222222222222222222222222222222222222222222",
      "3333333333333333333333333333333333333333333333333333333333333333"
    ],
    "createdAt": "2026-07-15T12:08:00Z",
    "updatedAt": "2026-07-15T12:14:00Z",
    "version": 4
  },
  "latestWaterfall": {
    "id": "0198a5ea-7c9c-7000-8000-000000000110",
    "claimId": "0198a5ea-7c9c-7000-8000-000000000101",
    "runNumber": 1,
    "inputSettlement": { "amountMinor": "6800000", "currency": "IDR", "scale": 2 },
    "principalPaid": { "amountMinor": "6400000", "currency": "IDR", "scale": 2 },
    "feesPaid": { "amountMinor": "160000", "currency": "IDR", "scale": 2 },
    "firstLossApplied": { "amountMinor": "0", "currency": "IDR", "scale": 2 },
    "seniorLoss": { "amountMinor": "0", "currency": "IDR", "scale": 2 },
    "sellerResidual": { "amountMinor": "240000", "currency": "IDR", "scale": 2 },
    "resultHash": "4444444444444444444444444444444444444444444444444444444444444444",
    "onchainTxHash": "3333333333333333333333333333333333333333333333333333333333333333",
    "executedAt": "2026-07-15T12:13:00Z"
  },
  "resolutionCase": null,
  "pendingOperation": null,
  "timeline": [
    { "id": "0198a5ea-7c9c-7000-8000-000000000111", "eventType": "jcc.issued", "label": "Eligibility credential registered", "actorRole": "ORACLE", "claimState": "ELIGIBLE", "reasonCodes": [], "stellarReferenceId": "happy-jcc", "occurredAt": "2026-07-15T12:02:00Z" },
    { "id": "0198a5ea-7c9c-7000-8000-000000000112", "eventType": "facility.position.funded", "label": "Facility position funded", "actorRole": "FACILITY", "claimState": "FUNDED", "reasonCodes": [], "stellarReferenceId": "happy-fund", "occurredAt": "2026-07-15T12:08:00Z" },
    { "id": "0198a5ea-7c9c-7000-8000-000000000113", "eventType": "claim.closed", "label": "Claim repaid, redeemed, and closed", "actorRole": "SYSTEM", "claimState": "CLOSED", "reasonCodes": [], "stellarReferenceId": "happy-close", "occurredAt": "2026-07-15T12:15:00Z" }
  ],
  "stellarReferences": [
    { "id": "happy-jcc", "kind": "TRANSACTION", "label": "JCC registration", "network": "TESTNET", "status": "RECONCILED", "transactionHash": "5555555555555555555555555555555555555555555555555555555555555555", "ledgerSequence": 1000001, "explorerUrl": "https://stellar.expert/explorer/testnet/tx/5555555555555555555555555555555555555555555555555555555555555555", "sandbox": true },
    { "id": "happy-fund", "kind": "TRANSACTION", "label": "Facility funding", "network": "TESTNET", "status": "RECONCILED", "transactionHash": "2222222222222222222222222222222222222222222222222222222222222222", "ledgerSequence": 1000002, "explorerUrl": "https://stellar.expert/explorer/testnet/tx/2222222222222222222222222222222222222222222222222222222222222222", "sandbox": true },
    { "id": "happy-close", "kind": "TRANSACTION", "label": "Waterfall and redemption finalization", "network": "TESTNET", "status": "RECONCILED", "transactionHash": "3333333333333333333333333333333333333333333333333333333333333333", "ledgerSequence": 1000003, "explorerUrl": "https://stellar.expert/explorer/testnet/tx/3333333333333333333333333333333333333333333333333333333333333333", "sandbox": true }
  ],
  "allowedActions": []
}
