{
  "checkpoint": { "version": 16, "asOf": "2026-07-15T13:20:00Z" },
  "chainMode": "TESTNET",
  "sandbox": true,
  "claim": {
    "id": "0198a5ea-7c9c-7000-8000-000000000201",
    "claimKey": "6666666666666666666666666666666666666666666666666666666666666666",
    "tenantId": "0198a5ea-7c9c-7000-8000-000000000200",
    "sellerId": "0198a5ea-7c9c-7000-8000-000000000202",
    "settlementStreamId": "0198a5ea-7c9c-7000-8000-000000000203",
    "facilityId": "0198a5ea-7c9c-7000-8000-000000000204",
    "state": "CLOSED_WITH_LOSS",
    "sourceCurrency": "IDR",
    "grossUnsettled": { "amountMinor": "10000000", "currency": "IDR", "scale": 2 },
    "eligibleSettlementValue": { "amountMinor": "5000000", "currency": "IDR", "scale": 2 },
    "advanceAmount": { "amountMinor": "6400000", "currency": "IDR", "scale": 2 },
    "outstandingPrincipal": { "amountMinor": "0", "currency": "IDR", "scale": 2 },
    "latestAttestationId": "0198a5ea-7c9c-7000-8000-000000000205",
    "controlEvidenceId": "0198a5ea-7c9c-7000-8000-000000000206",
    "onchainContractId": "CAAAAAAAAAAAAAAAAAAAAAAAAAAAAAAAAAAAAAAAAAAAAAAAAAAAAAAA",
    "onchainTxHash": "7777777777777777777777777777777777777777777777777777777777777777",
    "stateReasonCodes": ["SETTLEMENT_SHORTFALL"],
    "createdAt": "2026-07-15T13:00:00Z",
    "updatedAt": "2026-07-15T13:20:00Z",
    "version": 16
  },
  "latestAttestation": {
    "schema": "JEJAK_JCC_V1",
    "id": "0198a5ea-7c9c-7000-8000-000000000205",
    "attestationKey": "8888888888888888888888888888888888888888888888888888888888888888",
    "claimId": "0198a5ea-7c9c-7000-8000-000000000201",
    "claimKey": "6666666666666666666666666666666666666666666666666666666666666666",
    "sellerSubjectHash": "9999999999999999999999999999999999999999999999999999999999999999",
    "settlementStreamId": "0198a5ea-7c9c-7000-8000-000000000203",
    "dataSnapshotHash": "aaaaaaaaaaaaaaaaaaaaaaaaaaaaaaaaaaaaaaaaaaaaaaaaaaaaaaaaaaaaaaaa",
    "modelId": "jejak-sandbox-transparent-v1",
    "modelVersion": "1.0.0",
    "policyVersion": "sandbox-1",
    "decision": "REVIEW",
    "sdsBps": 4200,
    "grossUnsettled": { "amountMinor": "10000000", "currency": "IDR", "scale": 2 },
    "eligibleSettlementValue": { "amountMinor": "5000000", "currency": "IDR", "scale": 2 },
    "maxAdvanceAmount": { "amountMinor": "4000000", "currency": "IDR", "scale": 2 },
    "reasonCodes": ["HIGH_REFUND_RATE"],
    "issuedAt": "2026-07-15T13:06:00Z",
    "expiresAt": "2026-07-16T13:06:00Z",
    "status": "ACTIVE",
    "keyId": "sandbox-jcc-2026-07",
    "signature": "c2lnbmF0dXJl"
  },
  "latestOffer": {
    "id": "0198a5ea-7c9c-7000-8000-000000000207",
    "claimId": "0198a5ea-7c9c-7000-8000-000000000201",
    "originatorId": "0198a5ea-7c9c-7000-8000-000000000208",
    "principal": { "amountMinor": "6400000", "currency": "IDR", "scale": 2 },
    "fee": { "amountMinor": "160000", "currency": "IDR", "scale": 2 },
    "annualizedRateBps": 1800,
    "advanceRateBps": 8000,
    "expiresAt": "2026-07-16T13:01:00Z",
    "termsHash": "bbbbbbbbbbbbbbbbbbbbbbbbbbbbbbbbbbbbbbbbbbbbbbbbbbbbbbbbbbbbbbbb",
    "status": "ACCEPTED",
    "createdAt": "2026-07-15T13:01:00Z",
    "version": 2
  },
  "controlEvidence": {
    "id": "0198a5ea-7c9c-7000-8000-000000000206",
    "claimId": "0198a5ea-7c9c-7000-8000-000000000201",
    "mode": "SANDBOX",
    "status": "VERIFIED",
    "structure": "CONTROLLED_ACCOUNT",
    "evidenceHash": "cccccccccccccccccccccccccccccccccccccccccccccccccccccccccccccccc",
    "verifiedBy": "0198a5ea-7c9c-7000-8000-000000000208",
    "verifiedAt": "2026-07-15T13:01:00Z",
    "reasonCodes": [],
    "createdAt": "2026-07-15T13:01:00Z",
    "updatedAt": "2026-07-15T13:01:00Z",
    "version": 2
  },
  "facilityPosition": {
    "id": "0198a5ea-7c9c-7000-8000-000000000209",
    "facilityId": "0198a5ea-7c9c-7000-8000-000000000204",
    "claimId": "0198a5ea-7c9c-7000-8000-000000000201",
    "jclaimAssetCode": "JCLAIM",
    "jclaimIssuer": "GAAAAAAAAAAAAAAAAAAAAAAAAAAAAAAAAAAAAAAAAAAAAAAAAAAAAAAA",
    "fundingAssetCode": "JUSD",
    "fundingAssetIssuer": "GAAAAAAAAAAAAAAAAAAAAAAAAAAAAAAAAAAAAAAAAAAAAAAAAAAAAAAA",
    "principalBaseUnits": "64000000",
    "jclaimBaseUnits": "0",
    "firstLossBaseUnits": "8000000",
    "fundedAt": "2026-07-15T13:02:00Z",
    "repaidAt": "2026-07-15T13:20:00Z",
    "onchainTxHashes": ["dddddddddddddddddddddddddddddddddddddddddddddddddddddddddddddddd", "7777777777777777777777777777777777777777777777777777777777777777"],
    "createdAt": "2026-07-15T13:02:00Z",
    "updatedAt": "2026-07-15T13:20:00Z",
    "version": 6
  },
  "latestWaterfall": {
    "id": "0198a5ea-7c9c-7000-8000-000000000210",
    "claimId": "0198a5ea-7c9c-7000-8000-000000000201",
    "runNumber": 1,
    "inputSettlement": { "amountMinor": "4800000", "currency": "IDR", "scale": 2 },
    "principalPaid": { "amountMinor": "4800000", "currency": "IDR", "scale": 2 },
    "feesPaid": { "amountMinor": "0", "currency": "IDR", "scale": 2 },
    "firstLossApplied": { "amountMinor": "800000", "currency": "IDR", "scale": 2 },
    "seniorLoss": { "amountMinor": "800000", "currency": "IDR", "scale": 2 },
    "sellerResidual": { "amountMinor": "0", "currency": "IDR", "scale": 2 },
    "resultHash": "eeeeeeeeeeeeeeeeeeeeeeeeeeeeeeeeeeeeeeeeeeeeeeeeeeeeeeeeeeeeeeee",
    "onchainTxHash": "ffffffffffffffffffffffffffffffffffffffffffffffffffffffffffffffff",
    "executedAt": "2026-07-15T13:12:00Z"
  },
  "resolutionCase": {
    "id": "0198a5ea-7c9c-7000-8000-000000000211",
    "claimId": "0198a5ea-7c9c-7000-8000-000000000201",
    "status": "WRITTEN_OFF",
    "resolverAddress": "GAAAAAAAAAAAAAAAAAAAAAAAAAAAAAAAAAAAAAAAAAAAAAAAAAAAAAAA",
    "openedReasonCodes": ["SETTLEMENT_SHORTFALL"],
    "recoveryExpected": { "amountMinor": "1600000", "currency": "IDR", "scale": 2 },
    "recoveryRealized": { "amountMinor": "0", "currency": "IDR", "scale": 2 },
    "finalLoss": { "amountMinor": "800000", "currency": "IDR", "scale": 2 },
    "evidenceHashes": ["1111111111111111111111111111111111111111111111111111111111111111"],
    "openedAt": "2026-07-15T13:14:00Z",
    "closedAt": "2026-07-15T13:20:00Z",
    "version": 3
  },
  "pendingOperation": null,
  "timeline": [
    { "id": "0198a5ea-7c9c-7000-8000-000000000212", "eventType": "marketplace.refund_spike", "label": "Sandbox refund spike persisted", "actorRole": "SYSTEM", "claimState": "FUNDED", "reasonCodes": ["HIGH_REFUND_RATE"], "occurredAt": "2026-07-15T13:05:00Z" },
    { "id": "0198a5ea-7c9c-7000-8000-000000000213", "eventType": "claim.shortfall.detected", "label": "First loss consumed before senior loss", "actorRole": "SERVICER", "claimState": "SHORTFALL", "reasonCodes": ["SETTLEMENT_SHORTFALL"], "stellarReferenceId": "adverse-waterfall", "occurredAt": "2026-07-15T13:12:00Z" },
    { "id": "0198a5ea-7c9c-7000-8000-000000000214", "eventType": "resolution.closed", "label": "Resolution closed with explicit final loss", "actorRole": "RESOLVER", "claimState": "CLOSED_WITH_LOSS", "reasonCodes": ["SETTLEMENT_SHORTFALL"], "stellarReferenceId": "adverse-close", "occurredAt": "2026-07-15T13:20:00Z" }
  ],
  "stellarReferences": [
    { "id": "adverse-waterfall", "kind": "TRANSACTION", "label": "Shortfall waterfall", "network": "TESTNET", "status": "RECONCILED", "transactionHash": "ffffffffffffffffffffffffffffffffffffffffffffffffffffffffffffffff", "ledgerSequence": 1000010, "explorerUrl": "https://stellar.expert/explorer/testnet/tx/ffffffffffffffffffffffffffffffffffffffffffffffffffffffffffffffff", "sandbox": true },
    { "id": "adverse-close", "kind": "TRANSACTION", "label": "Resolution close", "network": "TESTNET", "status": "RECONCILED", "transactionHash": "7777777777777777777777777777777777777777777777777777777777777777", "ledgerSequence": 1000011, "explorerUrl": "https://stellar.expert/explorer/testnet/tx/7777777777777777777777777777777777777777777777777777777777777777", "sandbox": true }
  ],
  "allowedActions": []
}
